{
  "schema_version": 1,
  "slug": "smith-2019-a-fortran-solver",
  "source": {
    "url": "https://example.org/fortran-solver.git",
    "sha": "1234567",
    "author_date": null,
    "tag": null,
    "submodules": []
  },
  "language": "fortran",
  "inventory": {
    "modules": [],
    "symbols_total": 0,
    "note": "universal-ctags or tree-sitter is not yet wired for fortran"
  },
  "entry_points": [],
  "configs": [],
  "tests": [],
  "scripts": [],
  "data_requirements": [],
  "verified": false,
  "recipe": {
    "install_command": "pip install --no-build-isolation git+https://example.org/fortran-solver.git@1234567",
    "install_exit_code": 1,
    "checked_path": null,
    "run_command": null,
    "exit_code": null,
    "log": "$ pip install ...\nERROR: no pyproject.toml or setup.py found\n"
  },
  "api_map": [],
  "created": "2026-09-12T10:05:00.000Z"
}
